,0
58,"Artificial-intelligence tools are helping to scientists to come up with proteins that are shaped unlike anything in nature.Credit: Ian C Haydon/UW Institute for Protein Design

In June, South Korean regulators authorized the first-ever medicine, a COVID-19 vaccine, to be made from a novel protein designed by humans. The vaccine is based on a spherical protein ‘nanoparticle’ that was created by researchers nearly a decade ago, through a labour-intensive trial-and error-process1.

Now, thanks to gargantuan advances in artificial intelligence (AI), a team led by David Baker, a biochemist at the University of Washington (UW) in Seattle, reports in Science2,3 that it can design such molecules in seconds instead of months.

‘The entire protein universe’: AI predicts shape of nearly every known protein

Such efforts are a part of a scientific sea change, as AI tools such as DeepMind’s protein-structure-prediction software AlphaFold are embraced by life scientists. In July, DeepMind revealed that the latest version of AlphaFold had predicted structures for every protein known to science. And recent months have seen an explosive growth in AI tools — some based on AlphaFold — that can quickly dream up completely new proteins. Previously, this had been a painstaking pursuit with high failure rates.

“Since AlphaFold, there’s been a shift in the way we work with protein design,” says Noelia Ferruz, a computational biologist at the University of Girona, Spain. “We are witnessing very exciting times.”

Most efforts are focused on tools that can help to make original proteins, shaped unlike anything in nature, without much focus on what these molecules can do. But researchers — and a growing number of companies that are applying AI to protein design — would like to design proteins that can do useful things, from cleaning up toxic waste to treating diseases. Among the companies that are working towards this goal are DeepMind in London and Meta (formerly Facebook) in Menlo Park, California.

“The methods are already really powerful. They’re going to get more powerful,” says Baker. “The question is what problems are you going to solve with them.”

From scratch

Baker’s laboratory has spent the past three decades making new proteins. Software called Rosetta, which his lab started developing in the 1990s, splits the process into steps. Initially, researchers conceived a shape for a novel protein — often by cobbling together bits of other proteins — and the software deduced a sequence of amino acids that corresponded to this shape.

But these ‘first draft’ proteins rarely folded into the desired shape when made in the lab, and instead ended up stuck in different confirmations. So another step was needed to tweak the protein sequence such that it folded only into a single desired structure. This step, which involved simulating all the ways in which different sequences might fold, was computationally expensive, says Sergey Ovchinnikov, an evolutionary biologist at Harvard University in Cambridge, Massachusetts, who used to work in Baker’s lab. “You would literally have, like, 10,000 computers running for weeks doing this.”

What's next for AlphaFold and the AI protein-folding revolution

By tweaking AlphaFold and other AI programmes, that time-consuming step has become instantaneous, says Ovchinnikov. In one approach developed by Baker’s team, called hallucination, researchers feed random amino-acid sequences into a structure-prediction network; this alters the structure so that it becomes ever-more protein-like, as judged by the network’s predictions. In a 2021 paper, Baker’s team created more than 100 small, ‘hallucinated’ proteins in the lab and found signs that about one-fifth resembled the predicted shape4.

AlphaFold, and a similar tool developed by Baker’s lab called RoseTTAFold, were trained to predict the structure of individual protein chains. But researchers soon discovered that such networks could also model assemblies of multiple interacting proteins. On this basis, Baker and his team were confident they could hallucinate proteins that would self-assemble into nanoparticles of different shapes and sizes; these would be made up of numerous copies of a single protein and would be similar to those on which the COVID-19 vaccine is based.

Nik Spencer/Nature; Source: Adapted from N. Ferruz et al. Preprint at bioRxiv https://doi.org/10.1101/2022.08.31.505981 (2022); and J. Wang et al. Science 377, 387–394 (2022).

But when they instructed microorganisms to make their creations in the labs, none of the 150 designs worked. “They didn’t fold at all: they were just gunk at the bottom of the test tube,” says Baker.

Around the same time, another researcher in the lab, machine-learning scientist Justas Dauparas, was developing a deep-learning tool to address what is known as the inverse folding problem — determining a protein sequence that corresponds to a given protein’s overall shape3. The network, called ProteinMPNN, can act as a ‘spellcheck’ for designer proteins created using AlphaFold and other tools, says Ovchinnikov, by tweaking sequences while maintaining the molecules’ overall shape.

When Baker and his team applied this second network to their hallucinated protein nanoparticles, it had much greater success making the molecules experimentally. The researchers checked 30 of their new proteins using cryo-electron microscopy and other experimental techniques, and 27 of them matched the AI-led designs2. The team’s creations included giant rings with complex symmetries, unlike anything found in nature. In theory, the approach could be used to design nanoparticles corresponding to almost any symmetric shape, says Lukas Milles, a biophysicist who co-led the effort. “It is electrifying to see what these networks can do.”

Deep-learning revolution

Deep-learning tools such as proteinMPNN have been a game changer in protein design, says Arne Elofsson, a computational biologist at Stockholm University. “You draw your protein, push a button, and you get something that one in ten times works.” Even higher success rates can be achieved by combining multiple neural networks to tackle different parts of the design process, as Baker’s team did in designing the nanoparticles. “Now we have full control over the shape of the protein,” says Ovchinnikov.

Baker’s isn’t the only lab applying AI to protein design. In a review paper posted to the bioRxiv this month, Ferruz and her colleagues counted more than 40 AI protein-design tools that have been developed in recent years, using various approaches5 (see ‘How to design a protein’).

Many of these tools, including proteinMPNN, tackle the inverse folding problem: they specify a sequence that corresponds to a particular structure, often using approaches borrowed from image-recognition tools. Some others are based on an architecture similar to that of language neural networks such as GPT-3, which produces human-like text; but, instead, the tools are capable of producing novel protein sequences. “These networks are able to ‘speak’ proteins,” says Ferruz, who has co-developed one such network6.

With so many protein-design tools available, it’s not always clear how best to compare them, says Chloe Hsu, a machine-learning researcher at the University of California, Berkeley, who developed an inverse folding network with researchers from Meta7.

Four examples of protein ‘hallucination’. In each case, AlphaFold is presented with a random amino-acid sequence, predicts the structure, and changes the sequence until the software confidently predicts that it will fold into a protein with a well-defined 3D shape. Colours show prediction confidence (from red for very low confidence, through yellow and light blue to dark blue for very high confidence). Initial frames have been slowed down for clarity. Credit: Sergey Ovchinnikov

Many teams gauge their network’s ability to accurately determine the sequence of an existing protein from its structure. But this doesn’t apply for all methods, and it’s not clear how this metric, known as recovery rate, applies to the design of novel proteins, say scientists. Ferruz would like to see a protein-design competition, analogous to the biennial Critical Assessment of protein Structure Prediction (CASP) experiment, in which AlphaFold first demonstrated its superiority over other networks. “It’s a dream. Something like CASP would really move the field forward,” she says.

To the wet lab

Baker and his colleagues are adamant that making a novel protein in the lab is the ultimate test of their methods. Their initial failure to make hallucinated protein assemblies shows this. “AlphaFold thought they were fantastic proteins, but they clearly didn’t work in the wet lab,” says Basile Wicky, a biophysicist in Baker’s lab who co-led the effort, along with Baker, Milles and UW biochemist Alexis Courbet.

But not all scientists developing AI tools for protein design have easy access to experimental set-ups, notes Jinbo Xu, a computational biologist at the Toyota Technological Institute at Chicago in Illinois. Finding a lab to collaborate with can take time, so Xu is establishing his own wet lab to put his team’s creations to the test.

Experiments will also be essential when it comes to designing proteins with specific tasks in mind, says Baker. In July, his team described a pair of AI methods that allow researchers to embed a specific sequence or structure in a novel protein8. They used these approaches to design enzymes that catalyse particular reactions; proteins capable of binding to other molecules; and a protein that could be used in a vaccine against a respiratory virus that is a leading cause of infant hospitalizations.

Last year, DeepMind launched a spin-off company called Isomorphic Labs in London that intends to apply AI tools such as AlphaFold to drug discovery. DeepMind’s chief executive, Demis Hassabis, says that he sees protein design as an obvious and promising application for deep-learning technology, and for AlphaFold in particular. “We’re working quite a lot in the protein design space. It’s pretty early days.”"
59,"Machine learning software can identify individual pigs based on their facial features with high accuracy, which could help farmers give animals individualised food and veterinary care

Pigs have unique facial features that can be identified by machine learning software SRUC

Pigs could be issued with biometric passports based on facial recognition technology, giving farmers a more practical and welfare-friendly way of identifying individuals than ear notches or tags, the current industry standards.

Identifying pigs based on their unique facial features could enable them to receive individualised food and veterinary care, and be traced as they go through meat processing. With advanced algorithms and machine learning, it is possible to distinguish between the faces of even the most similar-looking …"
60,"In a laboratory study, human epithelial cells were treated with the lubricant before being exposed to HIV or a herpes virus, with subsequent infection rates being as low as 20 per cent

The mucus in cows’ salivary glands may have anti-viral properties Getty Images

A lubricant derived from the mucus of cow salivary glands has shown promise at preventing the human immunodeficiency virus (HIV) and a herpes virus from infecting healthy human cells.

Mucus is a protective gel that lubricates the epithelial tissues that cover our organs and line our body cavities, as well as acting as a first line of defence against microorganisms. The main component of mucus, a protein called mucin, may have antiviral properties.

Hongji Yan at the KTH Royal …"
61,"By modifying the embryonic skin cells of mice, researchers created hair follicles that grew up to 3 millimetres long over one month

A hair follicle generated from hair organoids – tiny, simple versions of an organ Yokohama National University

Mature hair follicles have been grown in a laboratory for the first time, in a move that could one day treat hair loss.

Artificially producing hair follicles has historically been very difficult, says Kairbaan Hodivala-Dilke at Queen Mary University of London, who wasn’t involved in the study. “Different types of cells need different sorts of nutrients and when they’re outside the body, they need different sorts of requirements compared to when they’re in the body.”

Among mammals, hair follicles are typically produced in embryos as a result of interactions between skin cells and connective tissue.

Advertisement

To better understand these interactions, Junji Fukuda at Yokohama National University in Japan and his colleagues studied hair follicle organoids – tiny, simple versions of an organ.

By controlling the organoids’ structure, the team was able to enhance hair follicle growth.

“We examined various conditions, including growth factors, activators and inhibitors of signalling pathways and essential culture medium components,” says Fukuda.

Read more: Long covid symptoms may include hair loss and ejaculation difficulties

The team’s main breakthrough was culturing mice embryonic skin cells in a special type of gel, which allowed the cells to be reprogrammed into hair follicles.

“If you think of a hair follicle, it’s got the hair down the middle of it and then it’s got layers of epithelial cells around the follicle and other specialised cells,” says Hodivala-Dilke. The gel allows these cells to grow in a laboratory in a way that means they can climb over and around each other [like they do in the body], she says.

The hair follicles grew for up to one month, reaching up to 3 millimetres long. “This is probably related to the fact that the hair cycle of mice is about one month,” says Fukuda.

The team is now working to recreate the experiment using human cells.

According to Hodivala-Dilke, laboratory-grown human hair follicles could one day treat hair loss. “You might be able to take hair from someone whose hair is really lush and make it grow in the lab and then use those follicles to do a transplant,” she says. Existing hair transplants involve moving hair from one part of the body to an area that is thinning or bald, which can cause scarring.

“This discovery is not going to cure hair loss, but it lays the foundation for somebody to potentially do so,” says Hodivala-Dilke.

Journal reference: Science Advances, DOI: 10.1126/sciadv.add4603"
62,"A device that measures acceleration very precisely using quantum effects could be used for navigation when GPS is unavailable

A quantum accelerometer could help ships navigate d13/Shutterstock

A quantum device that can determine its position in three dimensions is more accurate than non-quantum versions. Vehicles could use it to navigate even if GPS stopped working.

One way to keep track of something’s position is with an accelerometer, which is a small device that is found in everything from phones to drones. Accelerometers work by detecting changes in movement and therefore position.

It has been known for decades that quantum effects could be used make more accurate accelerometers, but most …"
63,"October 24, 2022, by Jasmina Ovcina Mandra

Image by Port of Newcastle

The world’s first bulk carrier to be partially powered by wind, the Shofu Maru, sailed into the Port of Newcastle this morning on its maiden voyage.

The 100, 422 dwt bulker, owned by Japanese shipping company Mitsui O.S.K. Lines (MOL), was delivered on October 7, 2022. The vessel is the first of its kind and it heralds a new era in modern shipping as wind propulsion marks its return as a sustainable power source.

Related Article Posted: about 1 month ago World’s 1st ship equipped with ‘Wind Challenger’ delivered Posted: about 1 month ago

Shofu Maru is fitted with the so-called Wind Challenger system, a telescoping hard sail that harnesses wind power to propel the vessel.

The system converts wind energy directly to a propulsive force. The installation of the sail on merchant ships has the potential to significantly reduce fuel consumption, which in turn reduces GHG emissions by about 5-8%. The sail can be shortened and extended (55 meters in length) adapting automatically to the wind conditions on board as it can rotate 360 degrees.

The vessel was greeted in the Port of Newcastle by a delegation of port officials and diplomatic dignitaries, including Consul-General of Japan in Sydney Tokuda Shuichi, Deputy Secretary of Safety, Environment and Regulation at Transport for NSW Tara McCarthy and MOL Managing Executive Officer for East/South East Asia and Oceania Nobuo Shiotsu.

The world’s first bulk carrier to be partially powered by wind, the Shofu Maru, sailed into #Newcastle this morning on its maiden voyage.



The vessel’s unique hard sail will reduce greenhouse gas emissions by around 5% on its Japan-Australia journey. pic.twitter.com/RXNEqO8zB8 — Port of Newcastle (@PortofNewcastle) October 24, 2022

“Port of Newcastle is pleased to join Port Authority of New South Wales in welcoming the vessel to our beautiful (and rainy) city, alongside the Consul-General of Japan in Sydney Tokuda Shuichi, Deputy Secretary of Safety, Environment and Regulation at Transport for NSW Tara McCarthy and MOL Managing Executive Officer for East/South East Asia and Oceania Nobuo Shiotsu,” the port authority said.

The 235-metre-long Shofu Maru will transport coal mainly from Australia, Indonesia, and North America as a dedicated vessel for Japan’s electric services company Tohoku Electric Power.

The vessel will now be loaded with its coal shipment, before it departs Newcastle on Tuesday.

MOL plans to build a second bulk carrier equipped with the Wind Challenger hard sail system at Oshima Shipbuilding. Under the plan, MOL Drybulk will operate the 62,900 dwt vessel, slated for delivery in 2024. Once completed, the vessel is chartered to transport wood pellets for Enviva, which specializes in the production of sustainable wood bioenergy.

MOL is also looking into the feasibility of adopting rotor sails, an auxiliary wind propulsion system developed by UK’s Anemoi Marine Technologies on the bulker. The combined use of both the Wind Challenger and rotor sails is expected to slash GHG emissions by an average of 20%.

Related Article Posted: 3 months ago MOL pens deal for 2nd Wind Challenger-fitted bulker Posted: 3 months ago

Exploration of the wind-assisted propulsion technology forms part of MOL’s overall decarbonization strategy. The MOL Group has set mid- to long-term targets to reduce GHG emissions intensity in marine transport by approximately 45% by 2035 (i.e. versus 2019) and achieve net zero by 2050."
64,"UNIVERSITY PARK, Pa. — A breakthrough in electric vehicle battery design has enabled a 10-minute charge time for a typical EV battery. The record-breaking combination of a shorter charge time and more energy acquired for longer travel range was announced today (Oct. 12) in the journal Nature.

“The need for smaller, faster-charging batteries is greater than ever,” said Chao-Yang Wang, the William E. Diefenderfer Professor of Mechanical Engineering at Penn State and lead author on the study. “There are simply not enough batteries and critical raw materials, especially those produced domestically, to meet anticipated demand.”

In August, California’s Air Resources Board passed an extensive plan to restrict and ultimately ban the sale of gasoline-powered cars within the state. By 2035, the largest auto market in the United States will effectively retire the internal combustion engine.

If new car sales are going to shift to battery-powered electric vehicles (EVs), Wang explained, they’ll need to overcome two major drawbacks: they are too slow to recharge and too large to be efficient and affordable. Instead of taking a few minutes at the gas pump, depending on the battery, some EVs can take all day to recharge.

“Our fast-charging technology works for most energy-dense batteries and will open a new possibility to downsize electric vehicle batteries from 150 to 50 kWh without causing drivers to feel range anxiety,” said Wang, whose lab partnered with State College-based startup EC Power to develop the technology. “The smaller, faster-charging batteries will dramatically cut down battery cost and usage of critical raw materials such as cobalt, graphite and lithium, enabling mass adoption of affordable electric cars.”

The technology relies on internal thermal modulation, an active method of temperature control to demand the best performance possible from the battery, Wang explained. Batteries operate most efficiently when they are hot, but not too hot. Keeping batteries consistently at just the right temperature has been major challenge for battery engineers. Historically, they have relied on external, bulky heating and cooling systems to regulate battery temperature, which respond slowly and waste a lot of energy, Wang said.

Wang and his team decided to instead regulate the temperature from inside the battery. The researchers developed a new battery structure that adds an ultrathin nickel foil as the fourth component besides anode, electrolyte and cathode. Acting as a stimulus, the nickel foil self-regulates the battery’s temperature and reactivity which allows for 10-minute fast charging on just about any EV battery, Wang explained.

“True fast-charging batteries would have immediate impact,” the researchers write. “Since there are not enough raw minerals for every internal combustion engine car to be replaced by a 150 kWh-equipped EV, fast charging is imperative for EVs to go mainstream.”

The study’s partner, EC Power, is working to manufacture and commercialize the fast-charging battery for an affordable and sustainable future of vehicle electrification, Wang said.

The other coauthors on the study are Teng Liu, Xiao-Guang Yang, Shanhai Ge and Yongjun Leng of Penn State and Nathaniel Stanley, Eric Rountree and Brian McCarthy of EC Power.

The work was supported by the U.S. Department of Energy, the U.S. Department of Defense, the U.S. Air Force and the William E. Diefenderfer Endowment."
