,0
36,"« press release »

Noctua presents NA-TPG1 thermal paste guard for AMD AM5

Vienna, October 6th 2022 – Noctua today announced its new NA-TPG1 thermal paste guard for AMD’s latest AM5 based Ryzen processors. When the mounting pressure of the cooling solution is applied, excess thermal paste will be squeezed outwards. With AM5 CPUs, this excess paste tends to accumulate in the cut-outs at the sides of the heat-spreader and may become difficult to remove. Simple and risk-free to apply, the NA-TPG1 prevents this undesired phenomenon.

“While there’s no denying that AMD’s new Ryzen 7000 processors perform fantastic, we found that the cut-outs at the side of the heat-spreader tend to attract thermal paste that can be challenging to clean off” says Roland Mossig (Noctua CEO). “This is where our new thermal paste guard steps in: it’s a simple yet highly effective tool for keeping your new Ryzen 7000 series CPU nice and clean.”

Made from highly heat-resistant polycarbonate and forming a tight seal around the edges of the CPU’s heat-spreader , the NA-TPG1 is simple and risk free to apply and remove. Despite its simplicity, it is highly efficient at preventing thermal paste from accumulating in the cut-outs at the sides of AM5 CPUs.

The NA-TPG1 will be available in a separate set with ten NA-CW1 cleaning wipes (NA-STPG1) as well as with new AM5 editions of Noctua’s award-winning NT-H1 and NT-H2 thermal pastes. All three products are scheduled to become available in December.

The manufacturer’s suggested retail price will be EUR/USD 7.90 for the NA-STPG1, EUR/USD 9.90 for the NT-H1 3.5g AM5 Edition and EUR/USD 13.90 for the NT-H2 3.5g AM5 Edition.

Links

« end of the press release »"
37,"CNN —

The first time molecular biologist Doris Taylor saw heart stem cells beat in unison in a petri dish, she was spellbound.

“It actually changed my life,” said Taylor, who directed regenerative medicine research at Texas Heart Institute in Houston until 2020. “I said to myself, ‘Oh my gosh, that’s life.’ I wanted to figure out the how and why, and re-create that to save lives.”

That goal has become reality. On Wednesday at the Life Itself conference, a health and wellness event presented in partnership with CNN, Taylor showed the audience the scaffolding of a pig’s heart infused with human stem cells – creating a viable, beating human heart the body will not reject. Why? Because it’s made from that person’s own tissues.

“Now we can truly imagine building a personalized human heart, taking heart transplants from an emergency procedure where you’re so sick, to a planned procedure,” Taylor told the audience.

“That reduces your risk by eliminating the need for (antirejection) drugs, by using your own cells to build that heart it reduces the cost … and you aren’t in the hospital as often so it improves your quality of life,” she said.

Debuting on stage with her was BAB, a robot Taylor painstakingly taught to inject stem cells into the chambers of ghost hearts inside a sterile environment. As the audience at Life Itself watched BAB functioning in a sterile environment, Taylor showed videos of the pearly white mass called a “ghost heart” begin to pinken.

Video Ad Feedback Can we grow a personalized human heart? 24:16 - Source: CNN

“It’s the first shot at truly curing the number one killer of men, women and children worldwide – heart disease. And then I want to make it available to everyone,” said Taylor to audience applause.

“She never gave up,” said Michael Golway, lead inventor of BAB and president and CEO of Advanced Solutions, which designs and creates platforms for building human tissues.

“At any point, Dr. Taylor could have easily said ‘I’m done, this just isn’t going to work. But she persisted for years, fighting setbacks to find the right type of cells in the right quantities and right conditions to enable those cells to be happy and grow.”

Giving birth to a heart

Taylor’s fascination with growing hearts began in 1998, when she was part of a team at Duke University that injected cells into a rabbit’s failed heart, creating new heart muscle. As trials began in humans, however, the process was hit or miss.

“We were putting cells into damaged or scarred regions of the heart and hoping that would overcome the existing damage,” she told CNN. “I started thinking: What if we could get rid of that bad environment and rebuild the house?”

Taylor’s first success came in 2008 when she and a team at the University of Minnesota washed the cells out of a rat’s heart and began to work with the translucent skeleton left behind.

Soon, she graduated to using pig’s hearts, due to their anatomical similarity to human hearts.

“We took a pig’s heart, and we washed out all the cells with a gentle baby shampoo,” she said. “What was left was an extracellular matrix, a transparent framework we called the ‘ghost heart.’

“Then we infused blood vessel cells and let them grow on the matrix for a couple of weeks,” Taylor said. “That built a way to feed the cells we were going to add because we’d reestablished the blood vessels to the heart.”

The next step was to begin injecting the immature stem cells into the different regions of the scaffold, “and then we had to teach the cells how to grow up.”

“We must electrically stimulate them, like a pacemaker, but very gently at first, until they get stronger and stronger. First, cells in one spot will twitch, then cells in another spot twitch, but they aren’t together,” Taylor said. “Over time they start connecting to each other in the matrix and by about a month, they start beating together as a heart. And let me tell you, it’s a ‘wow’ moment!”

This ""ghost heart,"" created by using the scaffolding of a pig's heart and injected it with human stem cells, may soon be ready for human clinical trials. Advanced Solutions Life Sciences

But that’s not the end of the “mothering” Taylor and her team had to do. Now she must nurture the emerging heart by giving it a blood pressure and teaching it to pump.

“We fill the heart chambers with artificial blood and let the heart cells squeeze against it. But we must help them with electrical pumps, or they will die,” she explained.

The cells are also fed oxygen from artificial lungs. In the early days all of these steps had to be monitored and coordinated by hand 24 hours a day, 7 days a week, Taylor said.

“The heart has to eat every day, and until we built the pieces that made it possible to electronically monitor the hearts someone had to do it person – and it didn’t matter if it was Christmas or New Year’s Day or your birthday,” she said. “It’s taken extraordinary groups of people who have worked with me over the years to make this happen.”

But once Taylor and her team saw the results of their parenting, any sacrifices they made became insignificant, “because then the beauty happens, the magic,” she said.

“We’ve injected the same type of cells everywhere in the heart, so they all started off alike,” Taylor said. “But now when we look in the left ventricle, we find left ventricle heart cells. If we look in the atrium, they look like atrial heart cells, and if we look in the right ventricle, they are right ventricle heart cells,” she said.

“So over time they’ve developed based on where they find themselves and grown up to work together and become a heart. Nature is amazing, isn’t she?”

Billions and billions of stem cells

As her creation came to life, Taylor began to dream about a day when her prototypical hearts could be mass produced for the thousands of people on transplant lists, many of whom die while waiting. But how do you scale a heart?

“I realized that for every gram of heart tissue we built, we needed a billion heart cells,” Taylor said. “That meant for an adult-sized human heart we would need up to 400 billion individual cells. Now, most labs work with a million or so cells, and heart cells don’t divide, which left us with the dilemma: Where will these cells come from?”

The answer arrived when Japanese biomedical researcher Dr. Shinya Yamanaka discovered human adult skin cells could be reprogrammed to behave like embryonic or “pluripotent” stem cells, capable of developing into any cell in the body. The 2007 discovery won the scientist a Nobel Prize, and his “induced pluripotent stem cells (iPS),” soon became known as “Yamanaka factors.”

“Now for the first time we could take blood, bone marrow or skin from a person and grow cells from that individual that could turn into heart cells,” Taylor said. “But the scale was still huge: We needed tens of billions of cells. It took us another 10 years to develop the techniques to do that.”

The solution? A bee-like honeycomb of fiber, with thousands of microscopic holes where the cells could attach and be nourished.

“The fiber soaks up the nutrients just like a coffee filter, the cells have access to food all around them and that lets them grow in much larger numbers. We can go from about 50 million cells to a billion cells in a week,” Taylor said. “But we need 40 billion or 50 billion or 100 billion, so part of our science over the last few years has been scaling up the number of cells we can grow.”

Another issue: Each heart needed a pristine environment free of contaminants for each step of the process. Every time an intervention had to be done, she and her team ran the risk of opening the heart up to infection – and death.

“Do you know how long it takes to inject 350 billion cells by hand?” Taylor asked the Life Itself audience. “What if you touch something? You just contaminated the whole heart.”

Once her lab suffered an electrical malfunction and all of the hearts died. Taylor and her team were nearly inconsolable.

“When something happens to one of these hearts, it’s devastating to all of us,” Taylor said. “And this is going to sound weird coming from a scientist, but I had to learn to bolster my own heart emotionally, mentally, spiritually and physically to get through this process.”

Dr. Doris Taylor (left) is teaching BAB the robot how to properly inject stem cells into a ghost heart. Advanced Solutions Life Sciences

Enter BAB, short for BioAssemblyBot, and an “uber-sterile” cradle created by Advance Solutions that could hold the heart and transport it between each step of the process while preserving a germ-free environment. Taylor has now taught BAB the specific process of injecting the cells she has painstakingly developed over the last decade.

“When Dr. Taylor is injecting cells, it has taken her years to figure out where to inject, how much pressure to put on the syringe, and the best speed and pace to add the cells,” said BAB’s creator Golway.

“A robot can do that quickly and precisely. And as we know, no two hearts are the same, so BAB can use ultrasound to see inside the vascular pathway of that specific heart, where Dr. Taylor is working blind, so to speak,” Golway added. “It’s exhilarating to watch – there are times where the hair on the back of my neck literally stands up.”

Taylor left academia in 2020 and is currently working with private investors to bring her creation to the masses. If transplants into humans in upcoming clinical trials are successful, Taylor’s personalized hybrid hearts could be used to save thousands of lives around the world.

In the US alone, some 3,500 people were on the heart transplant waiting list in 2021.

“That’s not counting the people who never make it on the list, due to their age or heath,” Taylor said. “If you’re a small woman, if you’re an underrepresented minority, if you’re a child, the chances of getting an organ that matches your body are low.

If you do get a heart, many people get sick or otherwise lose their new heart within a decade. We can reduce cost, we can increase access, and we can decrease side effects. It’s a win-win-win.”

Taylor can even envision a day when people bank their own stem cells at a young age, taking them out of storage when needed to grow a heart – and one day even a lung, liver or kidney.

“Say they have heart disease in their family,” she said. “We can plan ahead: Grow their cells to the numbers we need and freeze them, then when they are diagnosed with heart failure pull a scaffold off the shelf and build the heart within two months.

“I’m just humbled and privileged to do this work, and proud of where we are,” she added. “The technology is ready. I hope everyone is going to be along with us for the ride because this is game-changing.”"
38,"CNN —

Buildings don’t collapse very often – but when they do, it’s catastrophic for those trapped inside. Natural disasters like earthquakes and hurricanes can level entire towns, and for the search and rescue teams trying to find survivors, it’s a painstaking task.

But an unlikely savior is being trained up to help out: rats.

The project, conceived of by Belgian non-profit APOPO, is kitting out rodents with tiny, high-tech backpacks to help first responders search for survivors among rubble in disaster zones.

“Rats are typically quite curious and like to explore – and that is key for search and rescue,” says Donna Kean, a behavioral research scientist and leader of the project.

In addition to their adventurous spirit, their small size and excellent sense of smell make rats perfect for locating things in tight spaces, says Kean.

The rats are currently being trained to find survivors in a simulated disaster zone. They must first locate the target person in an empty room, pull a switch on their vest that triggers a beeper, and then return to base, where they are rewarded with a treat.

While the rodents are still in the early stages of training, APOPO is collaborating with the Eindhoven University of Technology to develop a backpack, which is equipped with a video camera, two-way microphone, and location transmitter to help first responders communicate with survivors.

“Together with the backpack and the training, the rats are incredibly useful for search and rescue,” says Kean.

Rat pack

APOPO has been training dogs and rats at its base in Tanzania in the scent detection of landmines and tuberculosis for over a decade. Its programs use African Giant Pouched Rats, which have a longer lifespan in captivity of around eight years compared to the four years of the common brown rat.

Life-saving rats — Tanzania-based NGO Apopo trains giant African pouched rats to sniff out land mines and detect tuberculosis -- two scourges that have had a tremendously negative impact on the African landscape. Tanzania-based NGO Apopo trains giant African pouched rats to sniff out land mines and detect tuberculosis -- two scourges that have had a tremendously negative impact on the African landscape. Courtesy Apopo Clearing Mozambique — In 2006, Apopo started testing rats on the mine fields in Mozambique, a country that at that time was one of the worst affected by landmines, thanks mainly to a civil war that ended in 1992. In 2006, Apopo started testing rats on the mine fields in Mozambique, a country that at that time was one of the worst affected by landmines, thanks mainly to a civil war that ended in 1992. Courtesy Apopo Almost mine-free — Since then, Apopo has cleared the country of 6,693 landmines, 29,934 small arms and ammunition, and 1,087 bombs. It is on track to clear Mozambique of landmines by the year's end. Since then, Apopo has cleared the country of 6,693 landmines, 29,934 small arms and ammunition, and 1,087 bombs. It is on track to clear Mozambique of landmines by the year's end. Courtesy Apopo Working with humans — Mine detection rats take nine months to a year to train. The rats are socialized when they are four-weeks-old so that they are comfortable working with humans. Mine detection rats take nine months to a year to train. The rats are socialized when they are four-weeks-old so that they are comfortable working with humans. Courtesy Apopo For the love of bananas — The rats are then conditioned with clicker training, so that they associate the sound of a click with a reward (usually peanuts or bananas). They are then introduced to a target scent (TNT or positive TB samples). The rats are then conditioned with clicker training, so that they associate the sound of a click with a reward (usually peanuts or bananas). They are then introduced to a target scent (TNT or positive TB samples). Courtesy Apopo Sandbox training — Mine-detection rats are then trained in a sandbox, where they are charged with sniffing out TNT-stuffed tea balls. Mine-detection rats are then trained in a sandbox, where they are charged with sniffing out TNT-stuffed tea balls. Courtesy Apopo Testing their know-how — In the final stage of training, mine-detection rats demonstrate their abilities at a training field at Morgoro, Tanzania -- the second largest in the world. It has over 1,500 mines, over 14 types are used during different training stages. In the final stage of training, mine-detection rats demonstrate their abilities at a training field at Morgoro, Tanzania -- the second largest in the world. It has over 1,500 mines, over 14 types are used during different training stages. Courtesy Apopo Speedy work — After a rat detects a mine, a manual deminer extracts the device. A single rat can clear 200 square feet in under an hour. It will take a manual deminer working alone about 50 hours to clear the same space. After a rat detects a mine, a manual deminer extracts the device. A single rat can clear 200 square feet in under an hour. It will take a manual deminer working alone about 50 hours to clear the same space. Courtesy Apopo An affordable solution — Because rats are small, they are also cheaper to transport and store than dogs -- who are traditionally employed to sniff out mines. In Africa, they are a cheaper option, because they are plentiful and easy to train. Each Apopo rat costs about $7,600 to train (a third the price it costs to train a dog). Because rats are small, they are also cheaper to transport and store than dogs -- who are traditionally employed to sniff out mines. In Africa, they are a cheaper option, because they are plentiful and easy to train. Each Apopo rat costs about $7,600 to train (a third the price it costs to train a dog). Courtesy Apopo Stuck in the lab — Apopo also trains rats to sniff out TB. Currently, the NGO's rodents are screening TB samples in Dar es Salaam, Tanzania and Maputo, Mozambique. Apopo also trains rats to sniff out TB. Currently, the NGO's rodents are screening TB samples in Dar es Salaam, Tanzania and Maputo, Mozambique. Briana Marie Going global — In addition to its work in Mozambique, Apopo has participated in mine-clearing projects in a number of countries, including Angola, Cambodia, Thailand, Vietnam and Lao. Here, one of Apopo's training supervisors works with a Cambodian trainer. In addition to its work in Mozambique, Apopo has participated in mine-clearing projects in a number of countries, including Angola, Cambodia, Thailand, Vietnam and Lao. Here, one of Apopo's training supervisors works with a Cambodian trainer. Courtesy Apopo Adopt a fuzzy friend — In order to raise funds, Apopo has launched an adopt-a-rat program, which allows participants to sponsor a 'hero rat'. In order to raise funds, Apopo has launched an adopt-a-rat program, which allows participants to sponsor a 'hero rat'. Courtesy Apopo Prev Next

While the search and rescue project only officially launched in April 2021, when Kean joined the team, APOPO had been trying to get the idea off the ground for years but lacked funding and a search and rescue partner to support it. But when volunteer search and rescue organization GEA approached APOPO in 2017 about the possibility of using rats in its missions, the team began exploring the idea.

A key component to the search and rescue mission was the technology to allow first responders to communicate with victims via the rats. APOPO didn’t have this – until electrical engineer Sander Verdiesen got involved.

Looking to “apply technology to improve lives” during his master’s studies at Eindhoven University of Technology, Verdiesen interned with APOPO in 2019 and was tasked with creating the first prototype of the rat backpack, to help rescuers get a better idea of what was going on inside disaster zones.

The prototype consisted of a 3D-printed plastic container with a video camera that sent live footage to a receiver module on a laptop, while also saving a high-quality version on an SD card. It attached to the rats with a neoprene vest, the same material that’s used for scuba suits.

APOPO trains the rats at its base in Tanzania, in rooms that replicate the debris and rubble of disaster zones. © APOPO

Verdiesen flew to Tanzania to test out the equipment and says that initially, the rats “didn’t really know how to deal with it” but adapted quickly. “By the end, they were just running around with the backpack on, no problem at all,” he adds.

Big challenges for tiny tech

With the backpacks working “better than expected,” Verdiesen continued to refine the design even after his internship ended, as a volunteer.

But sizing down technology and adapting it for disaster zones hasn’t been easy.

GPS can’t penetrate the dense rubble and debris of collapsed buildings, says Verdeisen. An alternative is the Inertial Measurement Unit, a location tracker used in the heels of firefighters’ boots.

“If you’re walking, your foot is going to be still every step or so – that’s where you can recalibrate. With the rats, we’re yet to find that,” he says. Other engineers are working on similar projects, so he’s hopeful they can find a solution.

The backpack currently contains a video camera, but APOPO hopes to also include a location tracker and two-way microphone. APOPO

Verdeisen is also trying to pack more technology into the next version, such as a two-way microphone, while reducing its size. Weighing around 140 grams (4.9 ounces), the prototype was twice as heavy as originally intended – although Verdeisen says that bulkiness was more of an issue, at 10 centimeters long (3.9 inches) and 4 centimeters deep (1.6 inches).

“The rats were walking up against something that they would normally be able to go under, and suddenly they can’t anymore,” he explains.

To make it “as small as possible” without losing any functionality, Verdeisen plans to integrate everything onto a single printed circuit board, which will free up more space. This upgraded version of the backpack should be ready later this year, and he hopes one day it can help first responders “to locate somebody that would otherwise not be rescued.”

Rodents to the rescue

Meanwhile, in Tanzania, Kean is increasing the complexity of the rats’ training environment, “to make it more like what they might encounter in real life.” That includes adding industrial sounds like drilling to mimic real emergencies.

So far, the results are promising: from her observations, Kean says the rats are responding well to the increasingly difficult simulations: “They have to be super confident in any environment, under any conditions, and that’s something that these rats are naturally good at.”

Handled from birth, the rats are exposed to a variety of environments, sights, sounds, and people as part of a “habituation process,” which makes their gradual exposure to more extreme situations less stressful, according to Kean.

As animals are at the center of APOPO’s projects and missions, welfare is a priority. The animals are trained in 15-minute sessions five days a week, and live alone or with same-sex siblings in home cages, which is also where they live out their days once they retire from working life.

Behavioral research scientist Donna Kean (pictured) says the rats are friendly, sociable, and easy to work with. © APOPO

Eating a diet of fresh fruit and vegetables, they also get daily playtime in a custom-built playroom – although, for the search and rescue rats, training is very similar, “just with a little bit of direction,” says Kean.

The program is still in development, but Kean estimates it will take at least nine to 12 months to train each rat.

For the next stage of training, Kean says the team will create “levels to mimic multiple floors of a collapsed building” and move closer to “real world scenarios.” Once the rats are confident in more complex environments, the project will move to Turkey, where GEA is based, for further preparation in more realistic environments. If that goes well, then the rats would potentially enter real-life situations.

For now, though, Kean and the team in Tanzania are focused on getting the rats through their first phase of training – and hopefully one day, into the field.

“Even if our rats find just one survivor at a debris site, I think we would be happy to know it’s made a difference somewhere,” says Kean."
