,0
21,"The study also includes lead authors Chonghe Wang and Xiaoyu Chen, and co-authors Liu Wang, Mitsutoshi Makihata, and Tao Zhao at MIT, along with Hsiao-Chuan Liu of the Mayo Clinic in Rochester, Minnesota.

“We envision a few patches adhered to different locations on the body, and the patches would communicate with your cellphone, where AI algorithms would analyze the images on demand,” says the study’s senior author, Xuanhe Zhao, professor of mechanical engineering and civil and environmental engineering at MIT. “We believe we’ve opened a new era of wearable imaging: With a few patches on your body, you could see your internal organs.”

If the devices can be made to operate wirelessly — a goal the team is currently working toward — the ultrasound stickers could be made into wearable imaging products that patients could take home from a doctor’s office or even buy at a pharmacy.

The current design requires connecting the stickers to instruments that translate the reflected sound waves into images. The researchers point out that even in their current form, the stickers could have immediate applications: For instance, the devices could be applied to patients in the hospital, similar to heart-monitoring EKG stickers, and could continuously image internal organs without requiring a technician to hold a probe in place for long periods of time.

The researchers applied the stickers to volunteers and showed the devices produced live, high-resolution images of major blood vessels and deeper organs such as the heart, lungs, and stomach. The stickers maintained a strong adhesion and captured changes in underlying organs as volunteers performed various activities, including sitting, standing, jogging, and biking.

In a paper appearing today in Science, the engineers present the design for a new ultrasound sticker — a stamp-sized device that sticks to skin and can provide continuous ultrasound imaging of internal organs for 48 hours.

Currently, ultrasound imaging requires bulky and specialized equipment available only in hospitals and doctor’s offices. But a new design by MIT engineers might make the technology as wearable and accessible as buying Band-Aids at the pharmacy.

Ultrasound imaging is a safe and noninvasive window into the body’s workings, providing clinicians with live images of a patient’s internal organs. To capture these images, trained technicians manipulate ultrasound wands and probes to direct sound waves into the body. These waves reflect back out to produce high-resolution images of a patient’s heart, lungs, and other deep organs.

A sticky issue

To image with ultrasound, a technician first applies a liquid gel to a patient’s skin, which acts to transmit ultrasound waves. A probe, or transducer, is then pressed against the gel, sending sound waves into the body that echo off internal structures and back to the probe, where the echoed signals are translated into visual images.

For patients who require long periods of imaging, some hospitals offer probes affixed to robotic arms that can hold a transducer in place without tiring, but the liquid ultrasound gel flows away and dries out over time, interrupting long-term imaging.

In recent years, researchers have explored designs for stretchable ultrasound probes that would provide portable, low-profile imaging of internal organs. These designs gave a flexible array of tiny ultrasound transducers, the idea being that such a device would stretch and conform with a patient’s body.

But these experimental designs have produced low-resolution images, in part due to their stretch: In moving with the body, transducers shift location relative to each other, distorting the resulting image.

“Wearable ultrasound imaging tool would have huge potential in the future of clinical diagnosis. However, the resolution and imaging duration of existing ultrasound patches is relatively low, and they cannot image deep organs,” says Chonghe Wang, who is an MIT graduate student.

An inside look

The MIT team’s new ultrasound sticker produces higher resolution images over a longer duration by pairing a stretchy adhesive layer with a rigid array of transducers. “This combination enables the device to conform to the skin while maintaining the relative location of transducers to generate clearer and more precise images.” Wang says.

The device’s adhesive layer is made from two thin layers of elastomer that encapsulate a middle layer of solid hydrogel, a mostly water-based material that easily transmits sound waves. Unlike traditional ultrasound gels, the MIT team’s hydrogel is elastic and stretchy.

“The elastomer prevents dehydration of hydrogel,” says Chen, an MIT postdoc. “Only when hydrogel is highly hydrated can acoustic waves penetrate effectively and give high-resolution imaging of internal organs.”

The bottom elastomer layer is designed to stick to skin, while the top layer adheres to a rigid array of transducers that the team also designed and fabricated. The entire ultrasound sticker measures about 2 square centimeters across, and 3 millimeters thick — about the area of a postage stamp.

The researchers ran the ultrasound sticker through a battery of tests with healthy volunteers, who wore the stickers on various parts of their bodies, including the neck, chest, abdomen, and arms. The stickers stayed attached to their skin, and produced clear images of underlying structures for up to 48 hours. During this time, volunteers performed a variety of activities in the lab, from sitting and standing, to jogging, biking, and lifting weights.

From the stickers’ images, the team was able to observe the changing diameter of major blood vessels when seated versus standing. The stickers also captured details of deeper organs, such as how the heart changes shape as it exerts during exercise. The researchers were also able to watch the stomach distend, then shrink back as volunteers drank then later passed juice out of their system. And as some volunteers lifted weights, the team could detect bright patterns in underlying muscles, signaling temporary microdamage.

“With imaging, we might be able to capture the moment in a workout before overuse, and stop before muscles become sore,” says Chen. “We do not know when that moment might be yet, but now we can provide imaging data that experts can interpret.”

The team is working to make the stickers function wirelessly. They are also developing software algorithms based on artificial intelligence that can better interpret and diagnose the stickers’ images. Then, Zhao envisions ultrasound stickers could be packaged and purchased by patients and consumers, and used not only to monitor various internal organs, but also the progression of tumors, as well as the development of fetuses in the womb.

“We imagine we could have a box of stickers, each designed to image a different location of the body,” Zhao says. “We believe this represents a breakthrough in wearable devices and medical imaging.”

This research was funded, in part, by MIT, the Defense Advanced Research Projects Agency, the National Science Foundation, the National Institutes of Health, and the U.S. Army Research Office through the Institute for Soldier Nanotechnologies at MIT."
22,"Scientist from the National University of Singapore (NUS) have found a novel way of growing cell-based meat by zapping animal cells with a magnet. This new technique simplifies the production process of cell-based meat by reducing reliance on animal products, and it is also greener, cleaner, safer and more cost-effective.

Cultured meat is an alternative to animal farming with advantages such as reducing carbon footprint and the risk of transmitting diseases in animals. However, the current method of producing cultured meat involves using other animal products, which largely defeats the purpose, or drugs to stimulate the growth of the meat.

To cultivate cell-based meat, animal cells are fed animal serum – usually foetal bovine serum (FBS), which is a mixture harvested from the blood of foetuses excised from pregnant cows slaughtered in the dairy or meat industries – to help them grow and proliferate. This is a critical, yet cruel and expensive, step in the current cell-based meat production process. Ironically, many of these molecules come from the muscles within the slaughtered animal, but scientists did not know how to stimulate their release in production scale bioreactors. Other methods to promote cell growth are using drugs or relying on genetic engineering.

The complex production process for cell-based meat increases cost, limits the manufacturing scale and undermines the commercial viability of cell-based meat.

To help address this challenge, a multidisciplinary research team led by Associate Professor Alfredo Franco-Obregón, who is from the NUS Institute for Health Innovation & Technology and the NUS Yong Loo Lin School of Medicine, came up with an unconventional method of using magnetic pulses to stimulate the growth of cell-based meat."
23,"A worm could be the answer to solving the problem of what to do about one of the commonest forms of plastic pollution.

Spanish researchers have found that chemicals in the saliva of the wax worm can break down polyethylene, a particularly hard-wearing material.

Their research found that exposing the plastic to the creature's saliva caused it to degrade as much in a single hour as several years worth of normal exposure to the elements.

Wax worms, the larvae of the wax moth, usually feed on the tough wax bees use to make honeycombs and are actually considered pests by beekeepers.

The study, published in the journal Nature Communications, discovered that two enzymes in the worm's saliva - which it uses to break down the wax - also break down the plastic.

For plastic to degrade, oxygen needs to penetrate the plastic's molecules, known as polymers, a process known as oxidation.

The research found that the enzymes in the saliva caused this process to occur in a matter of hours without any need to pre-treat the plastic by exposing it to heat or radiation.

Polyethylene is the most widely used plastic in the world and responsible for vast amounts of pollution.

First created in 1933, it is inexpensive, hard wearing and doesn't interact with food, making it widely used.

Advertisement

Specifically designed to be hard to break down, it can remain intact for decades.

Please use Chrome browser for a more accessible video player 0:38 A shoreline in Guatemala is completely awash with plastic waste.

Enzymes have been produced synthetically

However, this breakthrough could be set to change that with molecular biologist Federica Bertocchini of the Spanish National Research Council (CSIC), who led the study, saying it was ""changing the paradigm of plastic biodegradation"".

She went on to explain that they had not only found out which enzymes break down the plastic, but had also managed to produce them synthetically, avoiding the need to use billions of wax worms to do the job.

Read more:

'Jaw-dropping' amount of plastic thrown away by British households every year revealed

Microplastics found in human blood for first time after scientists make 'concerning finding'

Doing it that way would have several practical drawbacks and would also generate a large amount of carbon dioxide as the worms metabolise the polyethylene.

Plastic use has skyrocketed over the past 30 years, with hundreds of millions of tons ending up as waste every year, and less than 10% of that being recycled.

In March this year, the United Nations approved a landmark agreement to create the world's first global plastic pollution treaty after talks in Nairobi, with the goal of having a legally binding deal finalised by 2024.

Subscribe to ClimateCast on Spotify, Apple Podcasts, or Spreaker."
24,"A multi-disciplinary team at UNSW has found a way to convert nerve impulses into light, opening the way for more scalable neural implants.

Optrodes have the potential to make future prosthetics as functional as the limb they replace. Image: Shutterstock

Biomedical and electrical engineers at UNSW Sydney have developed a new way to measure neural activity using light – rather than electricity – which could lead to a complete reimagining of medical technologies like nerve-operated prosthetics and brain-machine interfaces.

Professor François Ladouceur, with UNSW’s School of Electrical Engineering and Telecommunications, says the multi-disciplinary team has just demonstrated in the lab what it proved theoretically shortly before the pandemic: that sensors built using liquid crystal and integrated optics technologies – dubbed ‘optrodes’ – can register nerve impulses in a living animal body.

Not only do these optrodes perform just as well as conventional electrodes – that use electricity to detect a nerve impulse – but they also address “very thorny issues that competing technologies cannot address”, says Prof. Ladouceur.

“Firstly, it’s very difficult to shrink the size of the interface using conventional electrodes so that thousands of them can connect to thousands of nerves within a very small area.

“One of the problems as you shrink thousands of electrodes and put them ever closer together to connect to the biological tissues is that their individual resistance increases, which degrades the signal-to-noise ratio so we have a problem reading the signal. We call this ‘impedance mismatch’.

“Another problem is what we call ‘crosstalk’ – when you shrink these electrodes and bring them closer together, they start to talk to, or affect each other because of their proximity.”

“The real advantage of our approach is that we can make this connection very dense in the optical domain and we don’t pay the price that you have to pay in the electrical domain,” Prof. Ladouceur says.

In research published recently in the Journal of Neural Engineering, Prof. Ladouceur and fellow researchers at UNSW wanted to show that they could use optrodes to accurately measure the neural impulses as they travel along a nerve fibre in a living animal.

Scientia Professor Nigel Lovell, who heads the Graduate School of Biomedical Engineering and is Director of the Tyree Foundation Institute of Health Engineering, was part of the research team that sought to demonstrate this in the lab.

He says the team connected an optrode to the sciatic nerve of an anaesthetised animal. The nerve was then stimulated with a small current and the neural signals were recorded with the optrode. Then they did the same using a conventional electrode and a bioamplifier.

“We demonstrated that the nerve responses were essentially the same,” says Prof. Lovell. “There’s still more noise in the optical one, but that’s not surprising given this is brand new technology, and we can work on that. But ultimately, we could identify the same characteristics by measuring electrically or optically.”

New dawn for prosthetics

So far the team has been able to show that nerve impulses – which are relatively weak and measured in microvolts – can be registered by optrode technology. The next step will be to scale up the number of optrodes to be able to handle complex networks of nervous and excitable tissue.

Prof. Ladouceur says at the beginning of the project, his colleagues asked themselves, how many neural connections does a man or woman need to operate a hand with a degree of finesse?

“That you can pick up an object, that you can judge the friction, you can apply just the right pressure to hold it, you can move from A to B with precision, you can go fast and slow – all these things that we don’t even think about when we perform these actions. The answer is not so obvious, we had to search quite a bit in the literature, but we believe it’s about 5000 to 10,000 connections.”

In other words, between your brain and your hand there is a bundle of nerves that travels down from your cortex and eventually divides into those 5000 to 10,000 nerves that control the delicate operations of your hand.

If a chip with thousands of optical connections could connect to your brain, or some place in the arm before the nerve bundle separates, a prosthetic hand could potentially be able to function with much the same ability as a biological one.

That’s the dream, anyway, and Prof. Ladouceur says there are likely decades of further research before it’s a reality. This would include developing the ability for optrodes to be bidirectional. Not only would they receive and interpret signals from the brain on the way to the body, they could receive feedback in the form of neural impulses going back to the brain.

The long game: brain-machine interface

Neural prosthetics isn’t the only space that optrode technology has the potential to redefine. Humans have long fantasised about integrating technology and machinery into the human body to either repair or enhance it.

Some of this is now a reality, such as Cochlear implants, pacemakers and cardiac defibrillators, not to mention smart watches and other tracking devices giving continual biofeedback.

But one of the more ambitious goals in biomedical engineering and neuroscience is the brain-machine interface that aims to connect the brain to not only the rest of the body, but potentially the world.

“The area of neural interfacing is an incredibly exciting field and will be the subject of intense research and development over the next decade,” says Prof. Lovell.

While this is more fiction than fact right now, there are many biotech companies taking this very seriously. Entrepreneur Elon Musk was one of the co-founders of Neuralink that aims to create brain-computer interfaces with the potential to help people with paralysis as well as incorporating artificial intelligence into our brain activities.

The Neuralink approach uses conventional wire electrodes in its devices so it must overcome impedance mismatch and crosstalk – among many other challenges – if they are to develop devices that host thousands, if not millions, of connections between the brain and the implanted device. Recently Mr Musk was reported as being frustrated at the slow pace in developing the technology.

Read more: UNSW engineers win US Naval grant to develop brain-machine interface

Prof. Ladouceur says time will tell whether Neuralink and its competitors succeed in removing these obstacles. However, given that implantable, in vivo devices that capture neural activity are currently constrained to about 100 or so electrodes, there is still a long way to go.

“I'm not saying that it's impossible, but it becomes really problematic if you were to stick to standard electrodes,” Prof. Ladouceur says.

“We don't have these problems in the optical domain. In our devices, if there is neural activity, its presence influences the orientation of the liquid crystal which we can detect and quantify by shining light on it. It means we don't extract current from the biological tissues as the wire electrodes do. And so the biosensing can be done much more efficiently.”

Now that the researchers have shown that the optrode method works in vivo, they will shortly publish research that shows the optrode technology is bidirectional – that it can not only read neural signals, but can write them too."
25,"A group of scientists with the University of Chicago have discovered a way to create a material that can be made like a plastic, but conducts electricity more like a metal. Above, members of the Anderson lab at work. Credit: John Zich/University of Chicago

Scientists with the University of Chicago have discovered a way to create a material that can be made like a plastic, but conducts electricity more like a metal.

The research, published Oct. 26 in Nature, shows how to make a kind of material in which the molecular fragments are jumbled and disordered, but can still conduct electricity extremely well.

This goes against all of the rules we know about for conductivity—to a scientist, it's kind of like seeing a car driving on water and still going 70 mph. But the finding could also be extraordinarily useful; if you want to invent something revolutionary, the process often first starts with discovering a completely new material.

""In principle, this opens up the design of a whole new class of materials that conduct electricity, are easy to shape, and are very robust in everyday conditions,"" said John Anderson, an associate professor of chemistry at the University of Chicago and the senior author on the study. ""Essentially, it suggests new possibilities for an extremely important technological group of materials,"" said Jiaze Xie (Ph.D. '22, now at Princeton), the first author on the paper.

'There isn't a solid theory to explain this'

Conductive materials are absolutely essential if you're making any kind of electronic device, whether it be an iPhone, a solar panel, or a television. By far the oldest and largest group of conductors is the metals: copper, gold, aluminum. Then, about 50 years ago, scientists were able to create conductors made out of organic materials, using a chemical treatment known as ""doping,"" which sprinkles in different atoms or electrons through the material.

This is advantageous because these materials are more flexible and easier to process than traditional metals, but the trouble is they aren't very stable; they can lose their conductivity if exposed to moisture or if the temperature gets too high.

But fundamentally, both of these organic and traditional metallic conductors share a common characteristic. They are made up of straight, closely packed rows of atoms or molecules. This means that electrons can easily flow through the material, much like cars on a highway. In fact, scientists thought a material had to have these straight, orderly rows in order to conduct electricity efficiently.

Then Xie began experimenting with some materials discovered years ago, but largely ignored. He strung nickel atoms like pearls into a string of of molecular beads made of carbon and sulfur, and began testing.

To the scientists' astonishment, the material easily and strongly conducted electricity. What's more, it was very stable. ""We heated it, chilled it, exposed it to air and humidity, and even dripped acid and base on it, and nothing happened,"" said Xie. That is enormously helpful for a device that has to function in the real world.

But to the scientists, the most striking thing was that the molecular structure of the material was disordered. ""From a fundamental picture, that should not be able to be a metal,"" said Anderson. ""There isn't a solid theory to explain this.""

Xie, Anderson, and their lab worked with other scientists around the university to try to understand how the material can conduct electricity. After tests, simulations, and theoretical work, they think that the material forms layers, like sheets in a lasagna. Even if the sheets rotate sideways, no longer forming a neat lasagna stack, electrons can still move horizontally or vertically—as long as the pieces touch.

The end result is unprecedented for a conductive material. ""It's almost like conductive Play-Doh—you can smush it into place and it conducts electricity,"" Anderson said.

The scientists are excited because the discovery suggests a fundamentally new design principle for electronics technology. Conductors are so important that virtually any new development opens up new lines for technology, they explained.

One of the material's attractive characteristics is new options for processing. For example, metals usually have to be melted in order to be made into the right shape for a chip or device, which limits what you can make with them, since other components of the device have to be able to withstand the heat needed to process these materials.

The new material has no such restriction because it can be made at room temperatures. It can also be used where the need for a device or pieces of the device to withstand heat, acid or alkalinity, or humidity has previously limited engineers' options to develop new technology.

The team is also exploring the different forms and functions the material might make. ""We think we can make it 2D or 3D, make it porous, or even introduce other functions by adding different linkers or nodes,"" said Xie.

More information: John Anderson, Intrinsic glassy-metallic transport in an amorphous coordination polymer, Nature (2022). DOI: 10.1038/s41586-022-05261-4. www.nature.com/articles/s41586-022-05261-4 Journal information: Nature"
